{
  "schemaVersion": "1.0",
  "packageId": "pkg-bruegmann-inv12-62027-v1",
  "runId": "contract-examples-v1",
  "invoice": {
    "invoiceId": "135d03ac-3598-498a-83fe-d273d046bfea",
    "invoiceNumber": "INV12-62027",
    "invoiceDate": "2026-08-26",
    "vendorId": "2153631",
    "vendorName": "Bruegmann USA, Inc.",
    "currency": "USD",
    "invoiceTotal": 1627.5,
    "poNumber": null,
    "countryRegion": "North America",
    "sourceSystem": "ABBYY"
  },
  "lines": [
    {
      "invoiceLineId": "135d03ac-3598-498a-83fe-d273d046bfea:1",
      "lineNumber": 1,
      "description": "Layover FR 4PK, 727x886\n15 degree front retainer rail slot\nSimplified\nNon-Anodized\nWidth: 28.6 (727mm)\nDepth: 34.9\" (886mm)\nColor: Black",
      "partNumber": "1 01 294",
      "quantity": 1.0,
      "unitCost": 253.71,
      "lineAmount": 253.71,
      "poLineNumber": null,
      "poDescription": null,
      "poTaskCode": null,
      "afeProjectId": null,
      "siteId": null
    },
    {
      "invoiceLineId": "135d03ac-3598-498a-83fe-d273d046bfea:2",
      "lineNumber": 2,
      "description": "Layover FR 1PK, 727x886\n15 degree front retainer rail slot\nSimplified\nNon-Anodized\nWidth: 28.6 (727mm)\nDepth: 34.9\" (886mm)\nColor: Black",
      "partNumber": "112664",
      "quantity": 3.0,
      "unitCost": 67.27,
      "lineAmount": 201.81,
      "poLineNumber": null,
      "poDescription": null,
      "poTaskCode": null,
      "afeProjectId": null,
      "siteId": null
    },
    {
      "invoiceLineId": "135d03ac-3598-498a-83fe-d273d046bfea:3",
      "lineNumber": 3,
      "description": "Reinforced Lock-In 2 Wire divider,\n70x886 50PK\nLayover\nAngled corners\n2-Wire 5mm\nDivider height: 2.75\" (70mm)\nFR depth: 34.9\" (886mm)\nColor: Black",
      "partNumber": "112020",
      "quantity": 1.0,
      "unitCost": 98.12,
      "lineAmount": 98.12,
      "poLineNumber": null,
      "poDescription": null,
      "poTaskCode": null,
      "afeProjectId": null,
      "siteId": null
    },
    {
      "invoiceLineId": "135d03ac-3598-498a-83fe-d273d046bfea:4",
      "lineNumber": 4,
      "description": "Reinforced Lock-In 2 Wire divider,\n70x886 10PK\nLayover\nAngled corners\n2-Wire 5mm\nDivider height: 2.75\" (70mm)\nFR depth: 34.9\" (886mm)\nColor: Black",
      "partNumber": "112018",
      "quantity": 2.0,
      "unitCost": 20.83,
      "lineAmount": 41.66,
      "poLineNumber": null,
      "poDescription": null,
      "poTaskCode": null,
      "afeProjectId": null,
      "siteId": null
    },
    {
      "invoiceLineId": "135d03ac-3598-498a-83fe-d273d046bfea:5",
      "lineNumber": 5,
      "description": "FlexRoller Clear Retainer 10PK 90x711\nRetainer height: Medium 3.5\" (90mm)\nRetainer width: 28\" (711mm)",
      "partNumber": "112675",
      "quantity": 1.0,
      "unitCost": 41.61,
      "lineAmount": 41.61,
      "poLineNumber": null,
      "poDescription": null,
      "poTaskCode": null,
      "afeProjectId": null,
      "siteId": null
    },
    {
      "invoiceLineId": "135d03ac-3598-498a-83fe-d273d046bfea:6",
      "lineNumber": 6,
      "description": "FlexRoller Clear Retainer 10PK, 35x711\nRetainer height: Mini 1.375\" (35mm)\nRetainer width: 28\" (711mm)",
      "partNumber": "1 01 255",
      "quantity": 1.0,
      "unitCost": 21.75,
      "lineAmount": 21.75,
      "poLineNumber": null,
      "poDescription": null,
      "poTaskCode": null,
      "afeProjectId": null,
      "siteId": null
    },
    {
      "invoiceLineId": "135d03ac-3598-498a-83fe-d273d046bfea:7",
      "lineNumber": 7,
      "description": "FR Back Wire Retainer 70x723 20PK\nHeight: 2.75\" (70mm)\nShelf Width: 28.5\" (723mm)\nColor: Red",
      "partNumber": "112667",
      "quantity": 1.0,
      "unitCost": 15.69,
      "lineAmount": 15.69,
      "poLineNumber": null,
      "poDescription": null,
      "poTaskCode": null,
      "afeProjectId": null,
      "siteId": null
    },
    {
      "invoiceLineId": "135d03ac-3598-498a-83fe-d273d046bfea:8",
      "lineNumber": 8,
      "description": "Infostrip 10PK\nLabel height: 1.25\" (32mm)\nSingle Wire Mount\nLength: 25.5\" (648mm)\nColor: Black\nWindow displayed at 20 degree to\nback",
      "partNumber": "112680",
      "quantity": 2.0,
      "unitCost": 9.07,
      "lineAmount": 18.14,
      "poLineNumber": null,
      "poDescription": null,
      "poTaskCode": null,
      "afeProjectId": null,
      "siteId": null
    },
    {
      "invoiceLineId": "135d03ac-3598-498a-83fe-d273d046bfea:9",
      "lineNumber": 9,
      "description": "Infostrip 10PK\nLabel height: 1.25\" (32mm)\nDouble Wire Mount\nLength: 27\" (685.8mm)\nColor: BlackOI",
      "partNumber": "114417",
      "quantity": 1.0,
      "unitCost": 12.17,
      "lineAmount": 12.17,
      "poLineNumber": null,
      "poDescription": null,
      "poTaskCode": null,
      "afeProjectId": null,
      "siteId": null
    },
    {
      "invoiceLineId": "135d03ac-3598-498a-83fe-d273d046bfea:10",
      "lineNumber": 10,
      "description": "Reinforced Lock-In Wire divider 20-\nPack, 140x886\nLayover\nAngled Corners\n3-Wire\nDivider height: 5.5\" (140mm)\nFR Depth: 34.88\" (886mm)\nColor: Black",
      "partNumber": "112672",
      "quantity": 3.0,
      "unitCost": 58.74,
      "lineAmount": 176.22,
      "poLineNumber": null,
      "poDescription": null,
      "poTaskCode": null,
      "afeProjectId": null,
      "siteId": null
    },
    {
      "invoiceLineId": "135d03ac-3598-498a-83fe-d273d046bfea:11",
      "lineNumber": 11,
      "description": "Reinforced Lock-In Wire divider 10-\nPack, 140x886\nLayover\nAngled Corners\n3-Wire\nDivider height: 5.5\" (140mm)\nFR Depth: 34.88\" (886mm)\nColor: Black",
      "partNumber": "112673",
      "quantity": 1.0,
      "unitCost": 30.2,
      "lineAmount": 30.2,
      "poLineNumber": null,
      "poDescription": null,
      "poTaskCode": null,
      "afeProjectId": null,
      "siteId": null
    },
    {
      "invoiceLineId": "135d03ac-3598-498a-83fe-d273d046bfea:12",
      "lineNumber": 12,
      "description": "Shipping",
      "partNumber": null,
      "quantity": 0.0,
      "unitCost": 0.0,
      "lineAmount": 617.09,
      "poLineNumber": null,
      "poDescription": null,
      "poTaskCode": null,
      "afeProjectId": null,
      "siteId": null
    }
  ],
  "context": {
    "businessUnit": null,
    "projectStatus": null,
    "projectType": null,
    "bundlingInScope": false
  },
  "dataQuality": {
    "missingPo": true,
    "missingProject": true,
    "missingSite": true,
    "warnings": [
      "Purchase-order context was not supplied.",
      "AFE/project context was not supplied.",
      "Site context was not supplied.",
      "Invoice total differs from the extracted line total; tax or another header-level charge may account for the difference."
    ]
  },
  "source": {
    "packageName": "Bruegmann  - INV1262027.pdf-135d03ac-3598-498a-83fe-d273d046bfea.zip",
    "sourceSha256": "974d61a406edf85e3cadfa75a5177795481d3a82ce962dc414e9d276b885ee5b"
  },
  "createdAtUtc": "2026-10-16T19:00:00Z"
}
